"title","content","date","variant","images","verified","author","rating","product","url"
"Effectively E-Waste if you dont listen to it in front of your computer or something","I have 2 of these, one given as a gift, one bought myself, both of these have the same issue, the second I put my phone in my pocket, the connectivity starts to die and the audio starts to cut off and on or even if I cover my ears with my hand or just simply look away from my iPad screen for more than 2 seconds, and eventually disconnects after 10-15 mins of strugging, the device I'm using this to play music with is no ordinary phone, its an iPhone 13, which should have world-class connectivity when it comes to bluetooth, I tried this with my other phones too, my Honor Play, iPad Mini 2019, Redmi Note 5 Pro and even a MacBook, the connectivity was EVEN worse than that on my iPhone. Its pretty evident that its the earphones are at fault, I don't know how people over here are saying that they are having a very good experience with these earphones, maybe they hold their phones in their hand all the time or use it with a computer in front of them🤔, worse part is that the connection drops even more in a more crowded area, for eg. a train station, they just give up in the rush hour(prolly cuz too much RF interference with the phones around them? idk). The mic just straightup sucks, the voice on the other end is utter rubbish, when I switched to the earpiece mode on my iPhone, the other end is able to hear it loud and clear, but when I switch to these, they just cant hear me. Bluetooth 5.1? Thats just for the spec sheet, yeah it connects fasts but if it has no range, its of no use either, am I right? 2 feet range, what a joke. The only reason these are even getting a 2 star rating from my end are that they have very good sound quality and are suprisingly comfortable for being 800 rupees plastic tipped earphones. After buying this, I'm gonna stay far clear from pTron, as I had another family member who bought a 3 ended(Micro USB + C + Lightning) braided pTron cable and the braid tore off revealing the white plastic cable inside, and cheap TWS earphones, I had a RealMe Buds Neo(this one didnt have bluetooth connectivity issues but as these were 2k so I ain't comparing) too in 2020, which I kept away for 4 months in 2021 and one side started having almost no sound after that along with the fact that the battery weakened so much that it was just lasting me like 30 mins of use, what a joke. I would recommend no-one to buy cheap TWS, they are just E-Waste, if you are looking for some good TWS earphones, dropping 5k+ on a pair would be an ideal bet if you would like them to last atleast 3 years, or just stick with wired, there are plenty of good sounding ones available in the 300-400 range, my personal fav is the boult bassbuds, the drivers on those are crazy good for the price, the only reason I'm out here looking for a pair of TWS is cuz my iPhone dosen't have a headphone jack or I would have sticked to wired, having a lightning converter seems awkward on my iPhone, I could go for AirPods 3 or the Pro but losing them while getting on the train or something would be a costly mishap considering I have already lost one of my old Gen 1s to the train tracks once XD, nope not again!","22 Sep 2022","Colour: Pearl White Style Name: Fute","","Yes","Tanish Singh","2.0","pTron Bassbuds Duo in Ear Earbuds with 32Hrs Total Playtime, Bluetooth 5.1 Wireless Headphones, Stereo Audio, Touch Control TWS, with Mic, Type-C Fast Charging, IPX4 & Voice Assistance (Black)","https://www.amazon.in/product-reviews/B09DD9SX9Z/ref=cm_cr_unknown?ie=UTF8&reviewerType=all_reviews&pageNumber=1"
"Reasonable product at this price range","After one week of use I am writing this review. Pros: 1. Good and decent sound quality what we can expect at this price range; Good bass but it overcomes voice clarity and we have to adjust the phones equaliser setting to get the ideal sound. 2. Design is good so that it sits in the ear without falling down. 3. Easily pairs without hazzle. 4. charging is ok. 5. Light weight and convenient to use. 6. Good for listening music. Cons: 1. The charging cable is very small (only few inches) and the quality is also bad. 2. The touch (button) is so sensitive and the setting changes if we accidentally touch the area which is very inconvenient. 3. Noise cancellation is very bad and it catches external air blow sounds etc. 4. Mic quality is average and we are getting complaints during voice call from the other end that the sound is not audible. 5. Above all, the delivery is very worst. Even after receiving at the destination amazon keeps it idle and delivers the next day only.","08 Apr 2023","Colour: Midnight Black Style Name: Duo","https://m.media-amazon.com/images/I/61AtsXqFjaL._SY88.jpg
https://m.media-amazon.com/images/I/61EYJIZgnQL._SY88.jpg
https://m.media-amazon.com/images/I/61OtOSdIr5L._SY88.jpg","Yes","Ramachandran","3.0","pTron Bassbuds Duo in Ear Earbuds with 32Hrs Total Playtime, Bluetooth 5.1 Wireless Headphones, Stereo Audio, Touch Control TWS, with Mic, Type-C Fast Charging, IPX4 & Voice Assistance (Black)","https://www.amazon.in/product-reviews/B09DD9SX9Z/ref=cm_cr_unknown?ie=UTF8&reviewerType=all_reviews&pageNumber=1"
"Ok for beginners","This is a OK product if you want to try earbuds before investing into higher rate products and want to see if you can go for it. Coz thats why I bought this product for. As I felt that I might lose the product while wearing helmet or while riding. It came with additional buds which I changed to more compatible with my ear, and It didnt fell out as I feared. Audio quality was Good, mostly used it at GYM or at office calls. Not so good in noise cancellation, and the audio was also quite low when I made calls, so I restricted this only to listening to music. If you want to try earbuds for first time then this is a good product.","03 May 2023","Colour: Midnight Black Style Name: Duo","","Yes","the reader","3.0","pTron Bassbuds Duo in Ear Earbuds with 32Hrs Total Playtime, Bluetooth 5.1 Wireless Headphones, Stereo Audio, Touch Control TWS, with Mic, Type-C Fast Charging, IPX4 & Voice Assistance (Black)","https://www.amazon.in/product-reviews/B09DD9SX9Z/ref=cm_cr_unknown?ie=UTF8&reviewerType=all_reviews&pageNumber=1"
"Itne paise mein itna  bhi mil reha hai khaadi hai","So after watching numerous videos on youtube for a cheap tws that does the job done. I was tempted to try these out. (For the asking price of 899) Its been just 5 days so it my initial impression on this regard. 1. Pricing 10/10 2. Balanced output 9/10 3. Build quality 8/10 4. Bt range 10/10 5. Call quality 4/10 6. Battery endurance 4/10 7. Earbud fit and finish 9/10 Summary: At this price , i love it  . You get a balanced sound profile clear vocals , instruments separation you can hear throughout and bass is there but not that oomp factor one ,its passable imo. Other than that you can still hear whats around you while wearing the buds in low volume (say 20-30 %) Both buds and case are of glossy plastic material it looks good and is good in terms sturdyness though i am worried for long term appearance (scratches and tearing out of paint). Bluetooth range is good its about 10 metres as mentioned albeit walls and obstacles will interrupt at peak distances. Call audio quality is the no no point on this one ... You can hear the other person clearly along with your own voice echoeing skirmish in the background and the other person will be complaining that they can't hear your voice clearly. ( Mics are not good) Battery life of the buds so far is 2 hours 15-20ish minutes on  full volume  its perfact for my workout sessions. And you can charge the buds 3 times with provided case (dont know how fast the charge up to 100) These buds are comfortable in my opinion they dont fall off easily or hurt my ear, infact they so light weight that  you forget you are wearing them while doing activities . My only nit picking is that the case has a design flow ; you cant take out the buds swiftly it always has to two handed operation and the hinge is a little annoying for me. Under 1000 isse jyada value for money nahi milta 😁","07 Sep 2022","Colour: Blue Style Name: Duo","","Yes","B.pertin","4.0","pTron Bassbuds Duo in Ear Earbuds with 32Hrs Total Playtime, Bluetooth 5.1 Wireless Headphones, Stereo Audio, Touch Control TWS, with Mic, Type-C Fast Charging, IPX4 & Voice Assistance (Black)","https://www.amazon.in/product-reviews/B09DD9SX9Z/ref=cm_cr_unknown?ie=UTF8&reviewerType=all_reviews&pageNumber=1"
"Disappointed","Basically I have 2 Disappointments 1) Product - I was expecting much after learning about the brand but unfortunately I didn't like the quality of product especially the latency of the sound during a call and sound of the voice ...and ofcourse The noise cancellation as well . 2). I wanted to return the product and go for some other product and whenever I tried to place a return order it was only directing me to a replacement of the product which was shocking and saddening for me I really hope Ptron reads this review about their product and allow me to do a return instead of replacement ... God Save me Thank you","27 Apr 2023","Colour: Midnight Black Style Name: Duo","","Yes","PVN Sai Vivek","3.0","pTron Bassbuds Duo in Ear Earbuds with 32Hrs Total Playtime, Bluetooth 5.1 Wireless Headphones, Stereo Audio, Touch Control TWS, with Mic, Type-C Fast Charging, IPX4 & Voice Assistance (Black)","https://www.amazon.in/product-reviews/B09DD9SX9Z/ref=cm_cr_unknown?ie=UTF8&reviewerType=all_reviews&pageNumber=1"
"Best value for money","This review is after using it for about a month. Pros: 1) sound quality is really fine tuned 2) bass and all the notes are tuned very well 3) fits very comfortably and doesn't fall(even used it during my morning run) 4) connects as soon as u remove it from the case 5) buds individually offers playback arround 2-2.5 hrs. 6) good noice cancellation when ur siting still. Cons: 1) mic used are very mediocre if ur riding a bike and attend a call the other person will only listen to the wind and not ur voice. 2) connectivity is not that strong even if the phone is very near sometimes it gets lag and the music pauses for a second. 3) we get battery indicator in phone for the buds but no indication is provided for the charge  of the case. 4) only one device can be connected at a time. 5) noise cancellation takes a hot it ur riding a bike as it cannot cancel the noice due to wind. 6) no fast charging available","04 Apr 2023","Colour: Blue Style Name: Duo","","Yes","Shreyes S shalgar","4.0","pTron Bassbuds Duo in Ear Earbuds with 32Hrs Total Playtime, Bluetooth 5.1 Wireless Headphones, Stereo Audio, Touch Control TWS, with Mic, Type-C Fast Charging, IPX4 & Voice Assistance (Black)","https://www.amazon.in/product-reviews/B09DD9SX9Z/ref=cm_cr_unknown?ie=UTF8&reviewerType=all_reviews&pageNumber=1"
"Really easy and comfortable to use","You can get phenomenal noise cancellation and sound quality in the premium tier of earbuds if you’re willing to spend big. But those aren’t always the most important criteria for everyone: maybe you’re looking for the perfect fitness earbuds or for a set that works just as well for Zoom calls as for playing your favorite playlists and podcasts. Good quality Long battery life Active noise cancellation Water resistance Good sound Comfort","01 May 2023","Colour: Black Style Name: Fute","","Yes","Appu","4.0","pTron Bassbuds Duo in Ear Earbuds with 32Hrs Total Playtime, Bluetooth 5.1 Wireless Headphones, Stereo Audio, Touch Control TWS, with Mic, Type-C Fast Charging, IPX4 & Voice Assistance (Black)","https://www.amazon.in/product-reviews/B09DD9SX9Z/ref=cm_cr_unknown?ie=UTF8&reviewerType=all_reviews&pageNumber=1"
"Best In Sound quality And Good Bass","The media could not be loaded. So after watching numerous videos on youtube for a cheap tws that does the job done. I was tempted to try these out. (For the asking price of 899) Its been just 5 month's so it my initial impression on this regard. 1. Pricing 8/10 2. Balanced output 9/10 3. Build quality 8/10 4. Bt range 10/10 5. Call quality 4/10 6. Battery endurance 4/10 7. Earbud fit and finish 9/10 Summary: At this price , i love it . You get a balanced sound profile clear vocals , instruments separation you can hear throughout and bass is there but not that oomp factor one ,its passable imo. Other than that you can still hear whats around you while wearing the buds in low volume (say 10-40 %) Both buds and case are of glossy plastic material it looks good and is good in terms sturdyness though i am worried for long term appearance (scratches and tearing out of paint). Bluetooth range is good its about 10 metres as mentioned albeit walls and obstacles will interrupt at peak distances. Call audio quality is the no no point on this one ... You can hear the other person clearly along with your own voice echoeing skirmish in the background and the other person will be complaining that they can't hear your voice clearly. ( Mics are not good) Battery life of the buds so far is 2 hours 15-20ish minutes on full volume its perfact for my workout sessions. And you can charge the buds 3 times with provided case (dont know how fast the charge up to 59) These buds are comfortable in my opinion they dont fall off easily or hurt my ear, infact they so light weight that you forget you are wearing them while doing activities . My only nit picking is that the case has a design flow ; you cant take out the buds swiftly it always has to two handed operation and the hinge is a little annoying for me. Under 800 isse jyada value for money nahi milta 😁","22 Oct 2022","Colour: Moon White Style Name: Duo","https://m.media-amazon.com/images/I/511fBVRfJwL._SY88.jpg
https://m.media-amazon.com/images/I/618aUhmPDzL._SY88.jpg
https://m.media-amazon.com/images/I/61Gb5tqOvZL._SY88.jpg
https://m.media-amazon.com/images/I/61Ps9eTqINL._SY88.jpg","Yes","Naresh khajuriya","4.0","pTron Bassbuds Duo in Ear Earbuds with 32Hrs Total Playtime, Bluetooth 5.1 Wireless Headphones, Stereo Audio, Touch Control TWS, with Mic, Type-C Fast Charging, IPX4 & Voice Assistance (Black)","https://www.amazon.in/product-reviews/B09DD9SX9Z/ref=cm_cr_unknown?ie=UTF8&reviewerType=all_reviews&pageNumber=1"
"Product valuation","after a long month of using ptron tws here is something i want to share about the product 1. Very light weight and small which increases the risk of getting lost 2. Product developers need to pay utmost attention to battery life 3. Battery storage also needs high attention of product developers 4. Sound quality can be improved 5. Overall performance should improve","07 May 2023","Colour: Midnight Black Style Name: Duo","","Yes","Mohammad Abubakar","3.0","pTron Bassbuds Duo in Ear Earbuds with 32Hrs Total Playtime, Bluetooth 5.1 Wireless Headphones, Stereo Audio, Touch Control TWS, with Mic, Type-C Fast Charging, IPX4 & Voice Assistance (Black)","https://www.amazon.in/product-reviews/B09DD9SX9Z/ref=cm_cr_unknown?ie=UTF8&reviewerType=all_reviews&pageNumber=1"
"Others can't listen to your voice on calls","Pros : low cost, fits in to the ears firmly (doesn't easily fall), listening to music is enjoyable, battery backup ok (not traced exact hours, but it  is not bad for this price). Cons : Our voice clarity (also volume) for others is worst on calls, not good for recording voice/songs, feel pain in ears if we use this buds along with helmet. Go for it, only if you just want to listen to music only  (choose Boat/other well known brands for calling and recording voice)","17 Apr 2023","Colour: Blue Style Name: Duo","","Yes","Balaji","3.0","pTron Bassbuds Duo in Ear Earbuds with 32Hrs Total Playtime, Bluetooth 5.1 Wireless Headphones, Stereo Audio, Touch Control TWS, with Mic, Type-C Fast Charging, IPX4 & Voice Assistance (Black)","https://www.amazon.in/product-reviews/B09DD9SX9Z/ref=cm_cr_unknown?ie=UTF8&reviewerType=all_reviews&pageNumber=1"
"Sound quality & calling","I have received this product today only, that quality of the case and buds is good, and the sound and bass is good. But the calling is not good my voice is not clear to the receiver. So I don't recommend this for calling. But the sound of Media and bass is good.","08 May 2023","Colour: Midnight Black Style Name: Duo","https://m.media-amazon.com/images/I/518LHeoGakL._SY88.jpg
https://m.media-amazon.com/images/I/51jaEy2jv1L._SY88.jpg
https://m.media-amazon.com/images/I/61L6lkVxKmL._SY88.jpg","Yes","Katroth Sandeep","3.0","pTron Bassbuds Duo in Ear Earbuds with 32Hrs Total Playtime, Bluetooth 5.1 Wireless Headphones, Stereo Audio, Touch Control TWS, with Mic, Type-C Fast Charging, IPX4 & Voice Assistance (Black)","https://www.amazon.in/product-reviews/B09DD9SX9Z/ref=cm_cr_unknown?ie=UTF8&reviewerType=all_reviews&pageNumber=2"
"Not upto Expectations","Sound quality average Battery backup is not good In call not clear to opposite side Only2 hrs backup for listening from 100% to 10% After 50% battery sound quality also down. Recommended to buy other company earbuds. Some coarse sound listen every time Built quality also very cheap Geninue feedback....... After 20 days uses","30 Apr 2023","Colour: Midnight Black Style Name: Duo","","Yes","Ranjan chand","3.0","pTron Bassbuds Duo in Ear Earbuds with 32Hrs Total Playtime, Bluetooth 5.1 Wireless Headphones, Stereo Audio, Touch Control TWS, with Mic, Type-C Fast Charging, IPX4 & Voice Assistance (Black)","https://www.amazon.in/product-reviews/B09DD9SX9Z/ref=cm_cr_unknown?ie=UTF8&reviewerType=all_reviews&pageNumber=2"
"Average","I use this for night purpose only. As I fall asleep with podcast. It's good for vocals and calls. But I would not 🚫 recommend it for music 🎵.","10 May 2023","Colour: Blue Style Name: Duo","","Yes","Eshan","4.0","pTron Bassbuds Duo in Ear Earbuds with 32Hrs Total Playtime, Bluetooth 5.1 Wireless Headphones, Stereo Audio, Touch Control TWS, with Mic, Type-C Fast Charging, IPX4 & Voice Assistance (Black)","https://www.amazon.in/product-reviews/B09DD9SX9Z/ref=cm_cr_unknown?ie=UTF8&reviewerType=all_reviews&pageNumber=2"
"Sound is good but microphone quality is pathetic","I loved the sound I heard, while playing music and movie. Base and treble is average. But the quality of the microphone is pathetic, the person you are talking to will surely ask you ""what, what, come again, I didn't getting you clearly"".","09 May 2023","Colour: Blue Style Name: Duo","","Yes","MD","3.0","pTron Bassbuds Duo in Ear Earbuds with 32Hrs Total Playtime, Bluetooth 5.1 Wireless Headphones, Stereo Audio, Touch Control TWS, with Mic, Type-C Fast Charging, IPX4 & Voice Assistance (Black)","https://www.amazon.in/product-reviews/B09DD9SX9Z/ref=cm_cr_unknown?ie=UTF8&reviewerType=all_reviews&pageNumber=2"
"Well good 😊","All about its good but some negative point's During call voice are not clear Range is too short","13 May 2023","Colour: Moon White Style Name: Duo","","Yes","Mr arfath","4.0","pTron Bassbuds Duo in Ear Earbuds with 32Hrs Total Playtime, Bluetooth 5.1 Wireless Headphones, Stereo Audio, Touch Control TWS, with Mic, Type-C Fast Charging, IPX4 & Voice Assistance (Black)","https://www.amazon.in/product-reviews/B09DD9SX9Z/ref=cm_cr_unknown?ie=UTF8&reviewerType=all_reviews&pageNumber=2"
"Im writing this review after the 1 week use","Built quality 2/5 Sound quality  3/5 Battery backup  3/5 In this price range it has good sound quality and bass So if you are looking for a earbud under 650 go for it! I bought this for 649/- Value for money 4/5","29 Apr 2023","Colour: Midnight Black Style Name: Duo","","Yes","Well-wisher","4.0","pTron Bassbuds Duo in Ear Earbuds with 32Hrs Total Playtime, Bluetooth 5.1 Wireless Headphones, Stereo Audio, Touch Control TWS, with Mic, Type-C Fast Charging, IPX4 & Voice Assistance (Black)","https://www.amazon.in/product-reviews/B09DD9SX9Z/ref=cm_cr_unknown?ie=UTF8&reviewerType=all_reviews&pageNumber=2"
"Calls not possible","Hi I am writing this review after 3 to 4 months of usage. Charging is very good..unless you have a very heavy usage it works for a very long time..I would have given 5 stars if I could hear calls.. music ok but when you get calls the other person can't hear you","05 May 2023","Colour: Blue Style Name: Duo","","Yes","khushbu","3.0","pTron Bassbuds Duo in Ear Earbuds with 32Hrs Total Playtime, Bluetooth 5.1 Wireless Headphones, Stereo Audio, Touch Control TWS, with Mic, Type-C Fast Charging, IPX4 & Voice Assistance (Black)","https://www.amazon.in/product-reviews/B09DD9SX9Z/ref=cm_cr_unknown?ie=UTF8&reviewerType=all_reviews&pageNumber=2"
"Sound not equal","Everything is good but right earbud volume little High than left bud, sound not equal!","13 May 2023","Colour: Midnight Black Style Name: Duo","","Yes","Pukar Da","4.0","pTron Bassbuds Duo in Ear Earbuds with 32Hrs Total Playtime, Bluetooth 5.1 Wireless Headphones, Stereo Audio, Touch Control TWS, with Mic, Type-C Fast Charging, IPX4 & Voice Assistance (Black)","https://www.amazon.in/product-reviews/B09DD9SX9Z/ref=cm_cr_unknown?ie=UTF8&reviewerType=all_reviews&pageNumber=2"
"Nice bro, every one should buy (with a budget)","Very good earphones under this budget. Everyone should buy them, but keep in mind the case battery lasts 4-5 of everyday use.","10 May 2023","Colour: Blue Style Name: Duo","","Yes","Anil Arora","4.0","pTron Bassbuds Duo in Ear Earbuds with 32Hrs Total Playtime, Bluetooth 5.1 Wireless Headphones, Stereo Audio, Touch Control TWS, with Mic, Type-C Fast Charging, IPX4 & Voice Assistance (Black)","https://www.amazon.in/product-reviews/B09DD9SX9Z/ref=cm_cr_unknown?ie=UTF8&reviewerType=all_reviews&pageNumber=2"
"Sound is best but calling quality is low","Product is nice but I received open piece and there is no warranty card available in the box","09 May 2023","Colour: Midnight Black Style Name: Duo","","Yes","Customer","4.0","pTron Bassbuds Duo in Ear Earbuds with 32Hrs Total Playtime, Bluetooth 5.1 Wireless Headphones, Stereo Audio, Touch Control TWS, with Mic, Type-C Fast Charging, IPX4 & Voice Assistance (Black)","https://www.amazon.in/product-reviews/B09DD9SX9Z/ref=cm_cr_unknown?ie=UTF8&reviewerType=all_reviews&pageNumber=2"
"Quality","Build is average Sound system well and good for this much amount You can complete your 20hrs journey without any fear because it's battery backup also well","11 May 2023","Colour: Blue Style Name: Duo","","Yes","Bala vignesh","3.0","pTron Bassbuds Duo in Ear Earbuds with 32Hrs Total Playtime, Bluetooth 5.1 Wireless Headphones, Stereo Audio, Touch Control TWS, with Mic, Type-C Fast Charging, IPX4 & Voice Assistance (Black)","https://www.amazon.in/product-reviews/B09DD9SX9Z/ref=cm_cr_unknown?ie=UTF8&reviewerType=all_reviews&pageNumber=3"
"Value for money product","Good product at this price range, sound quality was decent, I say Good 👍, battery life was very good. Play time is also very good, overall decent product at this price.","01 May 2023","Colour: Midnight Black Style Name: Duo","https://m.media-amazon.com/images/I/71qXcuqTXRL._SY88.jpg
https://m.media-amazon.com/images/I/81WKRNuC9XL._SY88.jpg","Yes","Asnad kaji","4.0","pTron Bassbuds Duo in Ear Earbuds with 32Hrs Total Playtime, Bluetooth 5.1 Wireless Headphones, Stereo Audio, Touch Control TWS, with Mic, Type-C Fast Charging, IPX4 & Voice Assistance (Black)","https://www.amazon.in/product-reviews/B09DD9SX9Z/ref=cm_cr_unknown?ie=UTF8&reviewerType=all_reviews&pageNumber=3"
"Worth of money","Product is good condition and amazing quality of product also good","09 May 2023","Colour: Midnight Black Style Name: Duo","","Yes","SHENBAGAANANDHAN M.","4.0","pTron Bassbuds Duo in Ear Earbuds with 32Hrs Total Playtime, Bluetooth 5.1 Wireless Headphones, Stereo Audio, Touch Control TWS, with Mic, Type-C Fast Charging, IPX4 & Voice Assistance (Black)","https://www.amazon.in/product-reviews/B09DD9SX9Z/ref=cm_cr_unknown?ie=UTF8&reviewerType=all_reviews&pageNumber=3"
"Value for money","the product is good as compared to the price rage it come","12 May 2023","Colour: Blue Style Name: Duo","","Yes","Ashutosh","4.0","pTron Bassbuds Duo in Ear Earbuds with 32Hrs Total Playtime, Bluetooth 5.1 Wireless Headphones, Stereo Audio, Touch Control TWS, with Mic, Type-C Fast Charging, IPX4 & Voice Assistance (Black)","https://www.amazon.in/product-reviews/B09DD9SX9Z/ref=cm_cr_unknown?ie=UTF8&reviewerType=all_reviews&pageNumber=3"
"Unequal sound distribution","The sound of ear buds are not equal at both side .the sound distribution of the earbuds are not good.The right earbuds is sounds very louder than the left one. And the earbuds case was also broken.","29 Apr 2023","Colour: Midnight Black Style Name: Duo","","Yes","Moon","3.0","pTron Bassbuds Duo in Ear Earbuds with 32Hrs Total Playtime, Bluetooth 5.1 Wireless Headphones, Stereo Audio, Touch Control TWS, with Mic, Type-C Fast Charging, IPX4 & Voice Assistance (Black)","https://www.amazon.in/product-reviews/B09DD9SX9Z/ref=cm_cr_unknown?ie=UTF8&reviewerType=all_reviews&pageNumber=3"
"Doesn't work as long as they have shown","I go to the gym for 2 hours and the earphone is full when leaving the home and is empty near the end of my session. It barely lasts 2 hours. Also, the charging box has gotten loose which sometimes makes the right earbud not charge until I press it down. The fitting, design, and interface are good and efficient.","14 Apr 2023","Colour: Midnight Black Style Name: Duo","","Yes","Mayuresh k.","3.0","pTron Bassbuds Duo in Ear Earbuds with 32Hrs Total Playtime, Bluetooth 5.1 Wireless Headphones, Stereo Audio, Touch Control TWS, with Mic, Type-C Fast Charging, IPX4 & Voice Assistance (Black)","https://www.amazon.in/product-reviews/B09DD9SX9Z/ref=cm_cr_unknown?ie=UTF8&reviewerType=all_reviews&pageNumber=3"
