"title","content","date","variant","images","verified","author","rating","product","url"
"Value for money product","Nice product","05 May 2023","Colour: Transparent Silver","https://m.media-amazon.com/images/I/817twwnN-6L._SY88.jpg","Yes","Hussain","5.0","ASUS Vivobook 16X (2022), 16.0-inch (40.64 cms) FHD+ 16:10, AMD Ryzen 5 5600H, Thin and Laptop (8GB/512GB SSD/Integrated Graphics/Windows 11/Office 2021/Silver/1.80 kg), M1603QA-MB501WS","https://www.amazon.in/product-reviews/B0B8ZT96HS?ref_=Oct_DLandingS_D_e9b39fbe_0/ref=cm_cr_unknown?ie=UTF8&reviewerType=all_reviews&pageNumber=3"
"Over all verry good product","performance 4.5 Display 5 battery 4 experiance 4.5","20 Apr 2023","Colour: Quiet Blue","https://m.media-amazon.com/images/I/6152z3bOjIL._SY88.jpg
https://m.media-amazon.com/images/I/61CWAJ8AHmL._SY88.jpg
https://m.media-amazon.com/images/I/61Ryc2jxJpL._SY88.jpg
https://m.media-amazon.com/images/I/61l5n+tE-TL._SY88.jpg
https://m.media-amazon.com/images/I/71g-YcQD6GL._SY88.jpg","Yes","KOUSIK BHOWMIK","5.0","ASUS Vivobook 16X (2022), 16.0-inch (40.64 cms) FHD+ 16:10, AMD Ryzen 5 5600H, Thin and Laptop (8GB/512GB SSD/Integrated Graphics/Windows 11/Office 2021/Silver/1.80 kg), M1603QA-MB501WS","https://www.amazon.in/product-reviews/B0B8ZT96HS?ref_=Oct_DLandingS_D_e9b39fbe_0/ref=cm_cr_unknown?ie=UTF8&reviewerType=all_reviews&pageNumber=3"
"Asus vivobook 16x","The media could not be loaded. Good value for money product. Laptop come with charger. And ms office also","28 Apr 2023","Colour: Transparent Silver","","Yes","Vivek Zade","5.0","ASUS Vivobook 16X (2022), 16.0-inch (40.64 cms) FHD+ 16:10, AMD Ryzen 5 5600H, Thin and Laptop (8GB/512GB SSD/Integrated Graphics/Windows 11/Office 2021/Silver/1.80 kg), M1603QA-MB501WS","https://www.amazon.in/product-reviews/B0B8ZT96HS?ref_=Oct_DLandingS_D_e9b39fbe_0/ref=cm_cr_unknown?ie=UTF8&reviewerType=all_reviews&pageNumber=3"
"Perfect laptop in this price range","Firstly the laptop look is awesome, we just see the laptop will be mesmerize and build quality is very good and they provide 1 year anti virus and life time ms office and windows 11 etc. Pros Anti glare display Backlit keyboard Amd ryzen 5 5600H processor Build quality Thermal cooling Value for money Cons Sound quality is decent Actually I don't see any cons much In the long run we may find some issues untill now the laptop is perfect in all aspects and i can recommend blindly u can go for it","12 Mar 2023","Colour: Transparent Silver","","Yes","BHANU","5.0","ASUS Vivobook 16X (2022), 16.0-inch (40.64 cms) FHD+ 16:10, AMD Ryzen 5 5600H, Thin and Laptop (8GB/512GB SSD/Integrated Graphics/Windows 11/Office 2021/Silver/1.80 kg), M1603QA-MB501WS","https://www.amazon.in/product-reviews/B0B8ZT96HS?ref_=Oct_DLandingS_D_e9b39fbe_0/ref=cm_cr_unknown?ie=UTF8&reviewerType=all_reviews&pageNumber=4"
"Best laptop in this range","Value for money Great battery 🔋 backup Display is good 👍","03 Feb 2023","Colour: Quiet Blue","","Yes","Amar","4.0","ASUS Vivobook 16X (2022), 16.0-inch (40.64 cms) FHD+ 16:10, AMD Ryzen 5 5600H, Thin and Laptop (8GB/512GB SSD/Integrated Graphics/Windows 11/Office 2021/Silver/1.80 kg), M1603QA-MB501WS","https://www.amazon.in/product-reviews/B0B8ZT96HS?ref_=Oct_DLandingS_D_e9b39fbe_0/ref=cm_cr_unknown?ie=UTF8&reviewerType=all_reviews&pageNumber=4"
"Decent laptop","Its a good buy within a budget. Lot of keyboard flex, so not the best build","30 Jan 2023","Colour: Transparent Silver","","Yes","MANUKRISHNA","4.0","ASUS Vivobook 16X (2022), 16.0-inch (40.64 cms) FHD+ 16:10, AMD Ryzen 5 5600H, Thin and Laptop (8GB/512GB SSD/Integrated Graphics/Windows 11/Office 2021/Silver/1.80 kg), M1603QA-MB501WS","https://www.amazon.in/product-reviews/B0B8ZT96HS?ref_=Oct_DLandingS_D_e9b39fbe_0/ref=cm_cr_unknown?ie=UTF8&reviewerType=all_reviews&pageNumber=4"
"Nice laptop at a very affordable price 👌 👍","Nice laptop at a very affordable price 👌 👍 This pc is good for basic multitasking...","07 Apr 2023","Colour: Quiet Blue","","Yes","Manish Nath","5.0","ASUS Vivobook 16X (2022), 16.0-inch (40.64 cms) FHD+ 16:10, AMD Ryzen 5 5600H, Thin and Laptop (8GB/512GB SSD/Integrated Graphics/Windows 11/Office 2021/Silver/1.80 kg), M1603QA-MB501WS","https://www.amazon.in/product-reviews/B0B8ZT96HS?ref_=Oct_DLandingS_D_e9b39fbe_0/ref=cm_cr_unknown?ie=UTF8&reviewerType=all_reviews&pageNumber=4"
"Worth Every Penny","Under this price range One of the best laptop H series processor I got 45k","04 Apr 2023","Colour: Quiet Blue","","Yes","Harsh","5.0","ASUS Vivobook 16X (2022), 16.0-inch (40.64 cms) FHD+ 16:10, AMD Ryzen 5 5600H, Thin and Laptop (8GB/512GB SSD/Integrated Graphics/Windows 11/Office 2021/Silver/1.80 kg), M1603QA-MB501WS","https://www.amazon.in/product-reviews/B0B8ZT96HS?ref_=Oct_DLandingS_D_e9b39fbe_0/ref=cm_cr_unknown?ie=UTF8&reviewerType=all_reviews&pageNumber=4"
"Good For Work Purpose","The media could not be loaded. My review is based on a month's use of the product. I hope you find it useful The laptop looks stylish and premium; however, only time will tell how durable it is. I use it for work-related purposes. The processor's clock speed is good, as is the performance. Highlights: 1. It looks premium (the ASUS logo is cherry) 2. The keyboard quality is good, and all essential keys are present, but what is interesting is the backlit keyboard. 3. There's no problem with the speaker quality, it's not bad, but it doesn't feel as good as Dolby audio 4. Pre-installed OS and MS Office 2021 (Home and Student) with lifetime validity. 5. Additionally, browsing speed is excellent 6. It's very difficult to carry around the laptop since it's not as lightweight as I expected. 7. With the ASUS application on your mobile device, it is easy to connect.","28 Sep 2022","Colour: Quiet Blue","https://m.media-amazon.com/images/I/71Iz9C57koL._SY88.jpg
https://m.media-amazon.com/images/I/71uzD+GOhAL._SY88.jpg
https://m.media-amazon.com/images/I/81WEwmFrLuL._SY88.jpg","Yes","Rohan","4.0","ASUS Vivobook 16X (2022), 16.0-inch (40.64 cms) FHD+ 16:10, AMD Ryzen 5 5600H, Thin and Laptop (8GB/512GB SSD/Integrated Graphics/Windows 11/Office 2021/Silver/1.80 kg), M1603QA-MB501WS","https://www.amazon.in/product-reviews/B0B8ZT96HS?ref_=Oct_DLandingS_D_e9b39fbe_0/ref=cm_cr_unknown?ie=UTF8&reviewerType=all_reviews&pageNumber=4"
"Great Allrounder","It's a allrounder laptop in budget..... Go for it without thinking anything......","24 Jan 2023","Colour: Quiet Blue","","Yes","Lachit Chowdhury","4.0","ASUS Vivobook 16X (2022), 16.0-inch (40.64 cms) FHD+ 16:10, AMD Ryzen 5 5600H, Thin and Laptop (8GB/512GB SSD/Integrated Graphics/Windows 11/Office 2021/Silver/1.80 kg), M1603QA-MB501WS","https://www.amazon.in/product-reviews/B0B8ZT96HS?ref_=Oct_DLandingS_D_e9b39fbe_0/ref=cm_cr_unknown?ie=UTF8&reviewerType=all_reviews&pageNumber=4"
"Best laptop ever","","28 Jan 2023","Colour: Transparent Silver","https://m.media-amazon.com/images/I/71ZhuzoNh2L._SY88.jpg","Yes","vinod kendre","4.0","ASUS Vivobook 16X (2022), 16.0-inch (40.64 cms) FHD+ 16:10, AMD Ryzen 5 5600H, Thin and Laptop (8GB/512GB SSD/Integrated Graphics/Windows 11/Office 2021/Silver/1.80 kg), M1603QA-MB501WS","https://www.amazon.in/product-reviews/B0B8ZT96HS?ref_=Oct_DLandingS_D_e9b39fbe_0/ref=cm_cr_unknown?ie=UTF8&reviewerType=all_reviews&pageNumber=4"
"Asus vivobook 16x","Great laptop,value for money,superb machine.","05 Apr 2023","Colour: Transparent Silver","https://m.media-amazon.com/images/I/61qfTAObppL._SY88.jpg
https://m.media-amazon.com/images/I/713lH9bGP7L._SY88.jpg
https://m.media-amazon.com/images/I/71HD8pA57ZL._SY88.jpg","Yes","Kindle Customer","5.0","ASUS Vivobook 16X (2022), 16.0-inch (40.64 cms) FHD+ 16:10, AMD Ryzen 5 5600H, Thin and Laptop (8GB/512GB SSD/Integrated Graphics/Windows 11/Office 2021/Silver/1.80 kg), M1603QA-MB501WS","https://www.amazon.in/product-reviews/B0B8ZT96HS?ref_=Oct_DLandingS_D_e9b39fbe_0/ref=cm_cr_unknown?ie=UTF8&reviewerType=all_reviews&pageNumber=4"
"Best laptop at this price","Overall good but anti glare is awesome 😎","26 Mar 2023","Colour: Transparent Silver","https://m.media-amazon.com/images/I/71zwArOKl+L._SY88.jpg","Yes","Akash Kumar Gupta","5.0","ASUS Vivobook 16X (2022), 16.0-inch (40.64 cms) FHD+ 16:10, AMD Ryzen 5 5600H, Thin and Laptop (8GB/512GB SSD/Integrated Graphics/Windows 11/Office 2021/Silver/1.80 kg), M1603QA-MB501WS","https://www.amazon.in/product-reviews/B0B8ZT96HS?ref_=Oct_DLandingS_D_e9b39fbe_0/ref=cm_cr_unknown?ie=UTF8&reviewerType=all_reviews&pageNumber=4"
"Just go for it .....","Design is 🔥🔥","12 Jan 2023","Colour: Transparent Silver","","Yes","Aniket","4.0","ASUS Vivobook 16X (2022), 16.0-inch (40.64 cms) FHD+ 16:10, AMD Ryzen 5 5600H, Thin and Laptop (8GB/512GB SSD/Integrated Graphics/Windows 11/Office 2021/Silver/1.80 kg), M1603QA-MB501WS","https://www.amazon.in/product-reviews/B0B8ZT96HS?ref_=Oct_DLandingS_D_e9b39fbe_0/ref=cm_cr_unknown?ie=UTF8&reviewerType=all_reviews&pageNumber=5"
"Good","Overall a value for money laptop....go for it👍","01 Jan 2023","Colour: Quiet Blue","","Yes","Rajraktim Saikia","4.0","ASUS Vivobook 16X (2022), 16.0-inch (40.64 cms) FHD+ 16:10, AMD Ryzen 5 5600H, Thin and Laptop (8GB/512GB SSD/Integrated Graphics/Windows 11/Office 2021/Silver/1.80 kg), M1603QA-MB501WS","https://www.amazon.in/product-reviews/B0B8ZT96HS?ref_=Oct_DLandingS_D_e9b39fbe_0/ref=cm_cr_unknown?ie=UTF8&reviewerType=all_reviews&pageNumber=5"
"Good product, perfect for my needs.","The media could not be loaded. Good product, i am using since 10 days and  i have no complains for this laptop. Screen is good (8/10,) and battery backup is just above average.","21 Mar 2023","Colour: Transparent Silver","https://m.media-amazon.com/images/I/61uuxHt0cgL._SY88.jpg
https://m.media-amazon.com/images/I/718cfFvOdsL._SY88.jpg
https://m.media-amazon.com/images/I/71NfL3fOvbL._SY88.jpg","Yes","Pawan Kumar √","5.0","ASUS Vivobook 16X (2022), 16.0-inch (40.64 cms) FHD+ 16:10, AMD Ryzen 5 5600H, Thin and Laptop (8GB/512GB SSD/Integrated Graphics/Windows 11/Office 2021/Silver/1.80 kg), M1603QA-MB501WS","https://www.amazon.in/product-reviews/B0B8ZT96HS?ref_=Oct_DLandingS_D_e9b39fbe_0/ref=cm_cr_unknown?ie=UTF8&reviewerType=all_reviews&pageNumber=5"
"Laptop is awesome....","Best for programming... Backlid keyboard is best for night. Backup is solid. It is giving around 10 + hour of battery life. What else should I expect from it. I am very happy with this purchase. Yes... I am not a gamer kind. So, I can't advise its usage based on Gaming experience.","27 Feb 2023","Colour: Quiet Blue","","Yes","Anish","5.0","ASUS Vivobook 16X (2022), 16.0-inch (40.64 cms) FHD+ 16:10, AMD Ryzen 5 5600H, Thin and Laptop (8GB/512GB SSD/Integrated Graphics/Windows 11/Office 2021/Silver/1.80 kg), M1603QA-MB501WS","https://www.amazon.in/product-reviews/B0B8ZT96HS?ref_=Oct_DLandingS_D_e9b39fbe_0/ref=cm_cr_unknown?ie=UTF8&reviewerType=all_reviews&pageNumber=5"
"best laptop under ₹50000.","don't know about the after sale service of ASUS but hand on this the best bang of your buck, do not confuse yourself with dump of youtube reviews. I would also recommend you to buyand installing a 8 GB DDR4 3200 MHz RAM along side with the laptop","28 Feb 2023","Colour: Quiet Blue","","Yes","OG_मंजीत","5.0","ASUS Vivobook 16X (2022), 16.0-inch (40.64 cms) FHD+ 16:10, AMD Ryzen 5 5600H, Thin and Laptop (8GB/512GB SSD/Integrated Graphics/Windows 11/Office 2021/Silver/1.80 kg), M1603QA-MB501WS","https://www.amazon.in/product-reviews/B0B8ZT96HS?ref_=Oct_DLandingS_D_e9b39fbe_0/ref=cm_cr_unknown?ie=UTF8&reviewerType=all_reviews&pageNumber=5"
"Good buy","Pros: Good specifications; Decent built model; Windows 11 is looking good on this . Picture quality is good. Touch pad, key board are nice to operate. Cons: Office 2021 mentioned as valid for one year, which is not fair as not indicated in specifications before buy. Hard disk capacity seems less if you want to store library of pictures. No proper document or soft copy of help on use of computer like for using recovery key, use of sd card ports etc. I am not seeing recycle bin in thr windows menu . Is there no option to eject External disk &SB drives? Overall satisfied.","31 Jul 2022","Colour: Quiet Blue","","Yes","Phaniraj","4.0","ASUS Vivobook 16X (2022), 16.0-inch (40.64 cms) FHD+ 16:10, AMD Ryzen 5 5600H, Thin and Laptop (8GB/512GB SSD/Integrated Graphics/Windows 11/Office 2021/Silver/1.80 kg), M1603QA-MB501WS","https://www.amazon.in/product-reviews/B0B8ZT96HS?ref_=Oct_DLandingS_D_e9b39fbe_0/ref=cm_cr_unknown?ie=UTF8&reviewerType=all_reviews&pageNumber=5"
"Best 16 inch laptop","Best 16 inch laptop with in the price range. nice display. sound quality is decent. ryzen 5 performs very well. Real life battery back up also good. I get 6 hours back up. overall quality good. very good for multi tasking .","14 Feb 2023","Colour: Transparent Silver","","Yes","Mrinmoi Jyoti Hazarika","5.0","ASUS Vivobook 16X (2022), 16.0-inch (40.64 cms) FHD+ 16:10, AMD Ryzen 5 5600H, Thin and Laptop (8GB/512GB SSD/Integrated Graphics/Windows 11/Office 2021/Silver/1.80 kg), M1603QA-MB501WS","https://www.amazon.in/product-reviews/B0B8ZT96HS?ref_=Oct_DLandingS_D_e9b39fbe_0/ref=cm_cr_unknown?ie=UTF8&reviewerType=all_reviews&pageNumber=5"
"Powerful laptop with good built","Very good laptop with Ryzen 5 5600H processor. The built quality is very good with less keyboard flex. Battery backup is also very good.","26 Feb 2023","Colour: Quiet Blue","","Yes","Sunny Kumar","5.0","ASUS Vivobook 16X (2022), 16.0-inch (40.64 cms) FHD+ 16:10, AMD Ryzen 5 5600H, Thin and Laptop (8GB/512GB SSD/Integrated Graphics/Windows 11/Office 2021/Silver/1.80 kg), M1603QA-MB501WS","https://www.amazon.in/product-reviews/B0B8ZT96HS?ref_=Oct_DLandingS_D_e9b39fbe_0/ref=cm_cr_unknown?ie=UTF8&reviewerType=all_reviews&pageNumber=5"
"Superb laptop at this price range...","The media could not be loaded. Best value for money. Got this during Great Indian sales. The laptop is just awesome. Checks in all segments. Good display, Keyboard is good the design looks premium, the battery and charging is good. The only flaw I noticed is the speaker. Sounds good. But they are placed downwards. Unless the laptop is upon some height the sound seems lesser compared to others. Rest is Good.","29 Sep 2022","Colour: Quiet Blue","https://m.media-amazon.com/images/I/71xC5h4d3uL._SY88.jpg","Yes","Sivakumar","4.0","ASUS Vivobook 16X (2022), 16.0-inch (40.64 cms) FHD+ 16:10, AMD Ryzen 5 5600H, Thin and Laptop (8GB/512GB SSD/Integrated Graphics/Windows 11/Office 2021/Silver/1.80 kg), M1603QA-MB501WS","https://www.amazon.in/product-reviews/B0B8ZT96HS?ref_=Oct_DLandingS_D_e9b39fbe_0/ref=cm_cr_unknown?ie=UTF8&reviewerType=all_reviews&pageNumber=5"
"Best for office work","Display is good, speed is good 1.9kg instead of 1.8kg Inbuilt Graphics card has 512Mb Battery average 5 hrs Speaker are just average-😔 I uninstalled Antivirus and Alexa","02 Mar 2023","Colour: Transparent Silver","","Yes","faiz ansari","5.0","ASUS Vivobook 16X (2022), 16.0-inch (40.64 cms) FHD+ 16:10, AMD Ryzen 5 5600H, Thin and Laptop (8GB/512GB SSD/Integrated Graphics/Windows 11/Office 2021/Silver/1.80 kg), M1603QA-MB501WS","https://www.amazon.in/product-reviews/B0B8ZT96HS?ref_=Oct_DLandingS_D_e9b39fbe_0/ref=cm_cr_unknown?ie=UTF8&reviewerType=all_reviews&pageNumber=5"
"No High Res Audio","Good screen, above average battery backup, Good processor but big down side is that it doesn't have high res audio , audio sampling is only limited to 16bit 48khz no matter which driver version you install, it should at least support 24bit 96khz, I recommend go for msi 7000 series laptops for high res audio.","01 Apr 2023","Colour: Quiet Blue","https://m.media-amazon.com/images/I/71T8lNz65UL._SY88.jpg","Yes","karthik reddy","2.0","ASUS Vivobook 16X (2022), 16.0-inch (40.64 cms) FHD+ 16:10, AMD Ryzen 5 5600H, Thin and Laptop (8GB/512GB SSD/Integrated Graphics/Windows 11/Office 2021/Silver/1.80 kg), M1603QA-MB501WS","https://www.amazon.in/product-reviews/B0B8ZT96HS?ref_=Oct_DLandingS_D_e9b39fbe_0/ref=cm_cr_unknown?ie=UTF8&reviewerType=all_reviews&pageNumber=6"
"problmes","product is good but I highlight issues I faced-1. due to the silver color backlight not looking good on days also hard to see the key name, 2- processor is terrible I would recommend going for intel not amd radeon issue with the high task also net browsing also makes it hang.","25 Mar 2023","Colour: Transparent Silver","","Yes","OFFYBUY S.","2.0","ASUS Vivobook 16X (2022), 16.0-inch (40.64 cms) FHD+ 16:10, AMD Ryzen 5 5600H, Thin and Laptop (8GB/512GB SSD/Integrated Graphics/Windows 11/Office 2021/Silver/1.80 kg), M1603QA-MB501WS","https://www.amazon.in/product-reviews/B0B8ZT96HS?ref_=Oct_DLandingS_D_e9b39fbe_0/ref=cm_cr_unknown?ie=UTF8&reviewerType=all_reviews&pageNumber=6"
"Very handy n user friendly","Great graphics.. Sound quality better than reviews. Solid built. Big mouse pad making it easy to use","24 Feb 2023","Colour: Quiet Blue","","Yes","Trisha Dass","5.0","ASUS Vivobook 16X (2022), 16.0-inch (40.64 cms) FHD+ 16:10, AMD Ryzen 5 5600H, Thin and Laptop (8GB/512GB SSD/Integrated Graphics/Windows 11/Office 2021/Silver/1.80 kg), M1603QA-MB501WS","https://www.amazon.in/product-reviews/B0B8ZT96HS?ref_=Oct_DLandingS_D_e9b39fbe_0/ref=cm_cr_unknown?ie=UTF8&reviewerType=all_reviews&pageNumber=6"
"Go for it ..","You will not regret buying this... Nice product","01 Mar 2023","Colour: Transparent Silver","","Yes","Ajay Rajput","5.0","ASUS Vivobook 16X (2022), 16.0-inch (40.64 cms) FHD+ 16:10, AMD Ryzen 5 5600H, Thin and Laptop (8GB/512GB SSD/Integrated Graphics/Windows 11/Office 2021/Silver/1.80 kg), M1603QA-MB501WS","https://www.amazon.in/product-reviews/B0B8ZT96HS?ref_=Oct_DLandingS_D_e9b39fbe_0/ref=cm_cr_unknown?ie=UTF8&reviewerType=all_reviews&pageNumber=6"
"Best Laptop","With best display, looks beautiful, good battery life, fast charger, superfast processor. Best for college students simple and light laptop.","22 Feb 2023","Colour: Quiet Blue","https://m.media-amazon.com/images/I/71aSAqSTZPL._SY88.jpg
https://m.media-amazon.com/images/I/71mI5SGrUTL._SY88.jpg
https://m.media-amazon.com/images/I/81hIzpfifyL._SY88.jpg","Yes","Aman Kumar","5.0","ASUS Vivobook 16X (2022), 16.0-inch (40.64 cms) FHD+ 16:10, AMD Ryzen 5 5600H, Thin and Laptop (8GB/512GB SSD/Integrated Graphics/Windows 11/Office 2021/Silver/1.80 kg), M1603QA-MB501WS","https://www.amazon.in/product-reviews/B0B8ZT96HS?ref_=Oct_DLandingS_D_e9b39fbe_0/ref=cm_cr_unknown?ie=UTF8&reviewerType=all_reviews&pageNumber=6"
"Amazing premium look","Just oneday old. Love the laptop. Great look.","21 Feb 2023","Colour: Transparent Silver","","Yes","BRAHMANANDA TRIPATHY","5.0","ASUS Vivobook 16X (2022), 16.0-inch (40.64 cms) FHD+ 16:10, AMD Ryzen 5 5600H, Thin and Laptop (8GB/512GB SSD/Integrated Graphics/Windows 11/Office 2021/Silver/1.80 kg), M1603QA-MB501WS","https://www.amazon.in/product-reviews/B0B8ZT96HS?ref_=Oct_DLandingS_D_e9b39fbe_0/ref=cm_cr_unknown?ie=UTF8&reviewerType=all_reviews&pageNumber=6"
"Nice laptop","","07 Mar 2023","Colour: Transparent Silver","https://m.media-amazon.com/images/I/71zww-UB+8L._SY88.jpg","Yes","Deepak kumar","5.0","ASUS Vivobook 16X (2022), 16.0-inch (40.64 cms) FHD+ 16:10, AMD Ryzen 5 5600H, Thin and Laptop (8GB/512GB SSD/Integrated Graphics/Windows 11/Office 2021/Silver/1.80 kg), M1603QA-MB501WS","https://www.amazon.in/product-reviews/B0B8ZT96HS?ref_=Oct_DLandingS_D_e9b39fbe_0/ref=cm_cr_unknown?ie=UTF8&reviewerType=all_reviews&pageNumber=6"
"Best budget Office Laptop","If you are a gamer, please skip this product. Strictly for office work. Build quality is just amazing. Battery on daily average usage goes upto 7+hours. Display is very bright with good viewing angles. Good screen for content consumption also. Speaker  sound way better then many laptop speakers in general. Its is loud for a 2W speaker along with nice clarity. Camera is HD so fulfills the purpose but obviously dnt expect mobile camera output. Its decent enough. Track pad is mega-sized so you wont be needing external mouse here. Keyboard will need some adjusting but typing experience is very good. Cons: 54k laptop comes with 8GB Ram and 512GB SSD. Should have been more.","07 Sep 2022","Colour: Quiet Blue","","Yes","tanmay","5.0","ASUS Vivobook 16X (2022), 16.0-inch (40.64 cms) FHD+ 16:10, AMD Ryzen 5 5600H, Thin and Laptop (8GB/512GB SSD/Integrated Graphics/Windows 11/Office 2021/Silver/1.80 kg), M1603QA-MB501WS","https://www.amazon.in/product-reviews/B0B8ZT96HS?ref_=Oct_DLandingS_D_e9b39fbe_0/ref=cm_cr_unknown?ie=UTF8&reviewerType=all_reviews&pageNumber=6"
"NOT RECOMMENDED FOR BUY","Laptop screen blacked out after 9 days.. no product support from AMaZON(WORST).. Never should buy online... Display quality- BAD Sound - OK Keyboard - WORST - cramped keys and not good for typing RAM management - few websites crashed even during normal web browsing.. Waited and booked onsite support through ASUS app.. When display goes black, how can they expect to troubleshoot??? recommendation NOT TO BUY this and from AMAZON - but latest level processor and model, not this","22 Apr 2023","Colour: Quiet Blue","","Yes","Amazon Customer","1.0","ASUS Vivobook 16X (2022), 16.0-inch (40.64 cms) FHD+ 16:10, AMD Ryzen 5 5600H, Thin and Laptop (8GB/512GB SSD/Integrated Graphics/Windows 11/Office 2021/Silver/1.80 kg), M1603QA-MB501WS","https://www.amazon.in/product-reviews/B0B8ZT96HS?ref_=Oct_DLandingS_D_e9b39fbe_0/ref=cm_cr_unknown?ie=UTF8&reviewerType=all_reviews&pageNumber=6"
"Worth the money","It's the best laptop in this price range. The speakers' quality is acceptable, the screen is good, no heating issue, good battery backup, and best of all it looks cool.","09 Aug 2022","Colour: Quiet Blue","https://m.media-amazon.com/images/I/61RLvM6kBaL._SY88.jpg
https://m.media-amazon.com/images/I/71HqiCKkgpL._SY88.jpg","Yes","mrinalini yadav","4.0","ASUS Vivobook 16X (2022), 16.0-inch (40.64 cms) FHD+ 16:10, AMD Ryzen 5 5600H, Thin and Laptop (8GB/512GB SSD/Integrated Graphics/Windows 11/Office 2021/Silver/1.80 kg), M1603QA-MB501WS","https://www.amazon.in/product-reviews/B0B8ZT96HS?ref_=Oct_DLandingS_D_e9b39fbe_0/ref=cm_cr_unknown?ie=UTF8&reviewerType=all_reviews&pageNumber=6"
"Best under 50k","Battery life is good I don't play game good for office and college","22 Jan 2023","Colour: Transparent Silver","","Yes","JJ","5.0","ASUS Vivobook 16X (2022), 16.0-inch (40.64 cms) FHD+ 16:10, AMD Ryzen 5 5600H, Thin and Laptop (8GB/512GB SSD/Integrated Graphics/Windows 11/Office 2021/Silver/1.80 kg), M1603QA-MB501WS","https://www.amazon.in/product-reviews/B0B8ZT96HS?ref_=Oct_DLandingS_D_e9b39fbe_0/ref=cm_cr_unknown?ie=UTF8&reviewerType=all_reviews&pageNumber=7"
"Good At its price","Good","30 Jan 2023","Colour: Transparent Silver","","Yes","Ubaid Aslam bhat","5.0","ASUS Vivobook 16X (2022), 16.0-inch (40.64 cms) FHD+ 16:10, AMD Ryzen 5 5600H, Thin and Laptop (8GB/512GB SSD/Integrated Graphics/Windows 11/Office 2021/Silver/1.80 kg), M1603QA-MB501WS","https://www.amazon.in/product-reviews/B0B8ZT96HS?ref_=Oct_DLandingS_D_e9b39fbe_0/ref=cm_cr_unknown?ie=UTF8&reviewerType=all_reviews&pageNumber=7"
"Performance & built quality is good","The screen is good(minor backlight bleeding) not the best.performance is good for day to day task & casual light gaming.","04 Aug 2022","Colour: Quiet Blue","","Yes","Sayan bhowmick","4.0","ASUS Vivobook 16X (2022), 16.0-inch (40.64 cms) FHD+ 16:10, AMD Ryzen 5 5600H, Thin and Laptop (8GB/512GB SSD/Integrated Graphics/Windows 11/Office 2021/Silver/1.80 kg), M1603QA-MB501WS","https://www.amazon.in/product-reviews/B0B8ZT96HS?ref_=Oct_DLandingS_D_e9b39fbe_0/ref=cm_cr_unknown?ie=UTF8&reviewerType=all_reviews&pageNumber=7"
"Speed","Best product for student I Buying for coding and study purpos Because I am BCA student","14 Jan 2023","Colour: Transparent Silver","","Yes","Jatin lodhi","5.0","ASUS Vivobook 16X (2022), 16.0-inch (40.64 cms) FHD+ 16:10, AMD Ryzen 5 5600H, Thin and Laptop (8GB/512GB SSD/Integrated Graphics/Windows 11/Office 2021/Silver/1.80 kg), M1603QA-MB501WS","https://www.amazon.in/product-reviews/B0B8ZT96HS?ref_=Oct_DLandingS_D_e9b39fbe_0/ref=cm_cr_unknown?ie=UTF8&reviewerType=all_reviews&pageNumber=7"
"Very good experience for basic use.","I bought this in 2022 June after 2.5 months, I have noticed these : PROs - 1.1  Battery life is good(approx 6hrs with YouTube) (2hrs while gaming) Can work approx 8hrs on MS office 2. No Heating 3. Audio quality is nice 4. compatible for travelling CONs - 1. Game crashes sometimes 2. Hinges are loose -- cannot stay in 160 degrees, it will automatically goto 180 degrees","19 Sep 2022","Colour: Quiet Blue","","Yes","G V.","5.0","ASUS Vivobook 16X (2022), 16.0-inch (40.64 cms) FHD+ 16:10, AMD Ryzen 5 5600H, Thin and Laptop (8GB/512GB SSD/Integrated Graphics/Windows 11/Office 2021/Silver/1.80 kg), M1603QA-MB501WS","https://www.amazon.in/product-reviews/B0B8ZT96HS?ref_=Oct_DLandingS_D_e9b39fbe_0/ref=cm_cr_unknown?ie=UTF8&reviewerType=all_reviews&pageNumber=7"
"Worst worst ever product","I want to tell those people are price sensitiv, pls avoid this product. Speakers are worst we cant hear with full volume. Camera is not working for me. build quality is worst. It feels like laptop will get broken into pieces if we touch the laptop. pls go for hp brand even it is costs around 5k more for same specs. strictly avoid this product.","11 Apr 2023","Colour: Quiet Blue","https://m.media-amazon.com/images/I/51Sv-f-YauL._SY88.jpg","Yes","Vijaykumar Juttu","1.0","ASUS Vivobook 16X (2022), 16.0-inch (40.64 cms) FHD+ 16:10, AMD Ryzen 5 5600H, Thin and Laptop (8GB/512GB SSD/Integrated Graphics/Windows 11/Office 2021/Silver/1.80 kg), M1603QA-MB501WS","https://www.amazon.in/product-reviews/B0B8ZT96HS?ref_=Oct_DLandingS_D_e9b39fbe_0/ref=cm_cr_unknown?ie=UTF8&reviewerType=all_reviews&pageNumber=7"
